original	target	ner_tag
帝闻之意不平问公卿曰奉使如此何如	帝闻之，意不平，问公卿曰：奉使如此，何如？	[13, 13, 2, 13, 13, 2, 13, 13, 13, 3, 13, 13, 13, 2, 13, 9]
妻惊欲省其子	妻惊，欲省其子。	[13, 2, 13, 13, 13, 0]
骑干孟已有功赐爵关内侯邑二百户	骑干孟已有功，赐爵关内侯，邑二百户。	[13, 13, 13, 13, 13, 2, 13, 13, 13, 13, 2, 13, 13, 13, 0]
乃假渊节	乃假渊节。	[13, 13, 13, 0]
间出所上太平政要策以示台臣曰此朕授经郎揭曼硕所进也	间出所上《太平政要策》以示台臣，曰：此朕授经郎揭曼硕所进也。	[13, 13, 13, 10, 13, 13, 13, 13, 11, 13, 13, 13, 2, 3, 13, 13, 13, 13, 13, 13, 13, 13, 13, 13, 0]
太尉不奉诏坚壁不出而使轻骑兵弓高侯等绝吴楚兵後食道	太尉不奉诏，坚壁不出，而使轻骑兵弓高侯等绝吴楚兵後食道。	[13, 13, 13, 13, 2, 13, 13, 13, 2, 13, 13, 13, 13, 13, 13, 13, 13, 13, 13, 13, 13, 13, 13, 13, 0]
但庶人畴昔之年身处不疑之地苞藏悖逆阴结宰臣所预奸谋多连宗戚	但庶人畴昔之年，身处不疑之地，苞藏悖逆，阴结宰臣，所预奸谋，多连宗戚。	[13, 13, 13, 13, 13, 13, 2, 13, 13, 13, 13, 13, 2, 13, 13, 13, 2, 13, 13, 13, 2, 13, 13, 13, 2, 13, 13, 13, 0]
皆不是也	皆不是也。	[13, 13, 13, 0]
平脾脉来和柔相离如鸡践地曰脾平	平脾脉来，和柔相离，如鸡践地，曰脾平。	[13, 13, 13, 2, 13, 13, 13, 2, 13, 13, 13, 2, 13, 13, 0]
上悦丙戌以度为门下侍郎同平章事兼彰义节度使仍充淮西宣慰招讨处置使又以户部侍郎崔群为中书侍朗同平章事	上悦，丙戌，以度为门下侍郎、同平章事、兼彰义节度使，仍充淮西宣慰招讨处置使。又以户部侍郎崔群为中书侍朗、同平章事。	[13, 2, 13, 2, 13, 13, 13, 13, 13, 13, 8, 13, 13, 13, 8, 13, 13, 13, 13, 13, 2, 13, 13, 13, 13, 13, 13, 13, 13, 13, 13, 0, 13, 13, 13, 13, 13, 13, 13, 13, 13, 13, 13, 13, 8, 13, 13, 13, 0]
中及时事有左右之者不得其人语颇伤执政末陈祖宗大阅之规京营之制冀有所兴革	中及时事，有左右之者不得其人语，颇伤执政；末陈祖宗大阅之规，京营之制，冀有所兴革。	[13, 13, 13, 2, 13, 13, 13, 13, 13, 13, 13, 13, 13, 2, 13, 13, 13, 1, 13, 13, 13, 13, 13, 13, 13, 2, 13, 13, 13, 2, 13, 13, 13, 13, 0]
射杀之	射杀之。	[13, 13, 0]
素遂止	素遂止。	[13, 13, 0]
今有小万岁大万岁二溪俱有桥架其上水俱自西而东	今有小万岁、大万岁二溪，俱有桥架其上，水俱自西而东。	[13, 13, 13, 13, 8, 13, 13, 13, 13, 2, 13, 13, 13, 13, 13, 2, 13, 13, 13, 13, 13, 0]
弘倧猝愕不暇发言趋入义和院	弘倧猝愕不暇发言，趋入义和院。	[13, 13, 13, 13, 13, 13, 13, 2, 13, 13, 13, 13, 0]
发引千钧	发引千钧。	[13, 13, 13, 0]
癸亥祭让国皇帝于行宫	癸亥，祭让国皇帝于行宫。	[13, 2, 13, 13, 13, 13, 13, 13, 13, 0]
是月成都河间檄长沙王乂讨之冏乂交战攻焚宫阙	是月，成都、河间檄长沙王乂讨之。冏、乂交战，攻焚宫阙。	[13, 2, 13, 8, 13, 13, 13, 13, 13, 13, 13, 13, 0, 8, 13, 13, 2, 13, 13, 13, 0]
穨当孽孙韩嫣贵幸名富显於当世	穨当孽孙韩嫣，贵幸，名富显於当世。	[13, 13, 13, 13, 13, 2, 13, 2, 13, 13, 13, 13, 13, 0]
身被二十余创贰师奏状诏征充国诣行在所武帝亲见视其创嗟叹之拜为中郎迁连骑将军长史	身被二十余创，贰师奏状，诏征充国诣行在所。武帝亲见视其创，嗟叹之，拜为中郎，迁连骑将军长史。	[13, 13, 13, 13, 13, 2, 13, 13, 13, 2, 13, 13, 13, 13, 13, 13, 13, 0, 13, 13, 13, 13, 13, 13, 2, 13, 13, 2, 13, 13, 13, 2, 13, 13, 13, 13, 13, 13, 0]
是宜传	是宜传。	[13, 13, 0]
十一月丁未大元进兵峣峰关由金州而东	十一月丁未，大元进兵峣峰关，由金州而东。	[13, 13, 13, 13, 2, 13, 13, 13, 13, 13, 13, 2, 13, 13, 13, 13, 0]
六月乙酉减四川酒课四十七万余缗	六月乙酉，减四川酒课四十七万余缗。	[13, 13, 13, 2, 13, 13, 13, 13, 13, 13, 13, 13, 13, 13, 0]
秋七月辛巳朔以镇东将军前大鸿胪卿太原王昶特为车骑大将军仪同三司	秋七月辛巳朔，以镇东将军、前大鸿胪卿、太原王昶特为车骑大将军、仪同三司。	[13, 13, 13, 13, 13, 2, 13, 13, 13, 13, 8, 13, 13, 13, 13, 8, 13, 13, 13, 13, 13, 13, 13, 13, 13, 13, 8, 13, 13, 13, 0]
于堂屋脊见一物面如狮子两颊垂白毛长尺许手足如人徐徐举一足须臾不见少时刘死	于堂屋脊，见一物，面如狮子，两颊垂白毛，长尺许，手足如人，徐徐举一足。须臾不见，少时刘死。	[13, 13, 13, 2, 13, 13, 2, 13, 13, 13, 2, 13, 13, 13, 13, 2, 13, 13, 2, 13, 13, 13, 2, 13, 13, 13, 13, 0, 13, 13, 13, 2, 13, 13, 13, 0]
神武造之景恚卧不动叫曰杀我时趣耶	神武造之，景恚卧不动，叫曰：杀我时趣耶！	[13, 13, 13, 2, 13, 13, 13, 13, 2, 13, 3, 13, 13, 13, 13, 12]
士卬皞卒后诸子事杨不尽礼衔之	士卬皞卒后，诸子事杨不尽礼，衔之。	[13, 13, 13, 13, 2, 13, 13, 13, 13, 13, 13, 2, 13, 0]
余药在器鸡犬舐之者俱得上升	余药在器，鸡犬舐之者，俱得上升。	[13, 13, 13, 2, 13, 13, 13, 13, 2, 13, 13, 13, 0]
夫人曰岂兹有异何为如此	夫人曰：岂兹有异，何为如此？	[13, 13, 3, 13, 13, 13, 2, 13, 13, 13, 9]
子游吊焉主人既小敛子游出绖反哭子夏曰闻之也与	子游吊焉，主人既小敛，子游出，绖反哭，子夏曰：闻之也与？	[13, 13, 13, 2, 13, 13, 13, 13, 2, 13, 13, 2, 13, 13, 2, 13, 13, 3, 13, 13, 13, 9]
九月乙亥下太原府元帅左监军兼知枢府事乌古论德升死之丙戌论皇太子曰军务之速动关机会悉从中覆则或稽缓	九月乙亥，下太原府，元帅左监军兼知枢府事乌古论德升死之。丙戌，论皇太子曰：军务之速，动关机会，悉从中覆，则或稽缓。	[13, 13, 13, 2, 13, 13, 13, 2, 13, 13, 13, 13, 13, 13, 13, 13, 13, 13, 13, 13, 13, 13, 13, 13, 0, 13, 2, 13, 13, 13, 13, 3, 13, 13, 13, 2, 13, 13, 13, 2, 13, 13, 13, 2, 13, 13, 13, 0]
如以頔常入财助国改过来觐两使绝域可以赎论夫伤物害人剥下奉上纳贿求幸尤不可长其渐焉	如以頔常入财助国，改过来觐，两使绝域，可以赎论，夫伤物害人，剥下奉上，纳贿求幸，尤不可长其渐焉。	[13, 13, 13, 13, 13, 13, 13, 2, 13, 13, 13, 2, 13, 13, 13, 2, 13, 13, 13, 2, 13, 13, 13, 13, 2, 13, 13, 13, 2, 13, 13, 13, 2, 13, 13, 13, 13, 13, 13, 0]
十二月辛酉振榆林延绥饥	十二月辛酉，振榆林、延绥饥。	[13, 13, 13, 13, 2, 13, 13, 8, 13, 13, 0]
台城陷后信奔于江陵	台城陷后，信奔于江陵。	[13, 13, 13, 2, 13, 13, 13, 13, 0]
幸约法之弘承解网之宥犹当降等薪粲遂乃顿释钳赭	幸约法之弘，承解网之宥，犹当降等薪粲，遂乃顿释钳赭。	[13, 13, 13, 13, 2, 13, 13, 13, 13, 2, 13, 13, 13, 13, 13, 2, 13, 13, 13, 13, 13, 0]
敕以阁门使吴德应等为馆驿使台谏上言故事御史巡驿不应忽以内臣代之	敕以阁门使吴德应等为馆驿使。台谏上言：故事，御史巡驿，不应忽以内臣代之。	[13, 13, 13, 13, 13, 13, 13, 13, 13, 13, 13, 13, 0, 13, 13, 13, 3, 13, 2, 13, 13, 13, 2, 13, 13, 13, 13, 13, 13, 13, 0]
甲辰诏以功臣配飨太庙	甲辰，诏以功臣配飨太庙。	[13, 2, 13, 13, 13, 13, 13, 13, 13, 0]
杨涟字文孺应山人	杨涟，字文孺，应山人。	[13, 2, 13, 13, 2, 13, 13, 0]
论也先捏以不忠不敬伏诛	论也先捏以不忠不敬，伏诛。	[13, 13, 13, 13, 13, 13, 13, 13, 2, 13, 0]
及温体仁讦谦益延儒助之	及温体仁讦谦益，延儒助之。	[13, 13, 13, 13, 13, 13, 2, 13, 13, 13, 0]
初举进士恶搜检烦琐去之	初举进士，恶搜检烦琐，去之。	[13, 13, 13, 2, 13, 13, 13, 13, 2, 13, 0]
辛未以前安南都护桂仲武为邕管经略使	辛未，以前安南都护桂仲武为邕管经略使。	[13, 2, 13, 13, 13, 13, 13, 13, 13, 13, 13, 13, 13, 13, 13, 13, 0]
太后遽追止之	太后遽追止之。	[13, 13, 13, 13, 13, 0]
帝答以玺书	帝答以玺书。	[13, 13, 13, 13, 0]
帝怒褫其职	帝怒，褫其职。	[13, 2, 13, 13, 0]
甲辰诏江南州县学田其岁入听其自掌春秋释奠外以廪师生及士之无告者	甲辰，诏：江南州县学田，其岁入听其自掌，春秋释奠外，以廪师生及士之无告者。	[13, 2, 3, 13, 13, 13, 13, 13, 2, 13, 13, 13, 13, 13, 13, 2, 13, 13, 13, 13, 2, 13, 13, 13, 13, 13, 13, 13, 13, 13, 0]
秋八月甲辰诏以班制俸禄更兴刑书宽猛未允人或异议	秋八月甲辰，诏以班制俸禄，更兴刑书，宽猛未允，人或异议。	[13, 13, 13, 13, 2, 13, 13, 13, 13, 13, 2, 13, 13, 13, 2, 13, 13, 13, 2, 13, 13, 13, 0]
某女说云宅后有竹丛与高锴侍郎墓近其中有野狐窟穴因被其魅	某女说云，宅后有竹丛，与高锴侍郎墓近，其中有野狐窟穴，因被其魅。	[13, 13, 13, 2, 13, 13, 13, 13, 2, 13, 13, 13, 13, 13, 13, 2, 13, 13, 13, 13, 13, 13, 2, 13, 13, 13, 0]
与子人事一人焉先达者相收	与子人事一人焉，先达者相收。	[13, 13, 13, 13, 13, 13, 2, 13, 13, 13, 13, 0]
度律军以此先退遂大败	度律军以此先退，遂大败。	[13, 13, 13, 13, 13, 13, 2, 13, 13, 0]
壬午岐军进迫兴平王师自溃	壬午，岐军进迫兴平，王师自溃。	[13, 2, 13, 13, 13, 13, 13, 2, 13, 13, 13, 0]
时辽东太守祭肜威詟北方声行海表于是濊貊倭韩万里朝献故章和已后使聘流通	时辽东太守祭肜威詟北方，声行海表，于是濊、貊、倭、韩，万里朝献，故章、和已后，使聘流通。	[13, 13, 13, 13, 13, 13, 13, 13, 13, 13, 2, 13, 13, 13, 2, 13, 13, 8, 8, 8, 2, 13, 13, 13, 2, 13, 8, 13, 13, 2, 13, 13, 13, 0]
由是议者莫能定其兄弟优劣	由是议者莫能定其兄弟优劣。	[13, 13, 13, 13, 13, 13, 13, 13, 13, 13, 13, 0]
三月辛巳东海县民张旺徐元等反遣都水监徐文步军指挥使张弘信同知大兴尹事李惟忠宿直将军萧阿窊率舟师九百浮海讨之命之曰朕意不在一邑将试舟师耳	三月辛巳，东海县民张旺、徐元等反，遣都水监徐文、步军指挥使张弘信、同知大兴尹事李惟忠、宿直将军萧阿窊率舟师九百，浮海讨之，命之曰：朕意不在一邑，将试舟师耳。	[13, 13, 13, 2, 13, 13, 13, 13, 13, 8, 13, 13, 13, 2, 13, 13, 13, 13, 13, 8, 13, 13, 13, 13, 13, 13, 13, 8, 13, 13, 13, 13, 13, 13, 13, 13, 8, 13, 13, 13, 13, 13, 13, 13, 13, 13, 13, 13, 2, 13, 13, 13, 2, 13, 13, 3, 13, 13, 13, 13, 13, 2, 13, 13, 13, 13, 0]
及孝武西迁东魏遣侯景袭穰胜败遂南奔梁	及孝武西迁，东魏遣侯景袭穰，胜败，遂南奔梁。	[13, 13, 13, 13, 2, 13, 13, 13, 13, 13, 13, 2, 13, 2, 13, 13, 13, 0]
子弘嗣甘露中有罪削爵为关内侯	子弘嗣，甘露中有罪削爵为关内侯。	[13, 13, 2, 13, 13, 13, 13, 13, 13, 13, 13, 13, 13, 0]
珍白禧曰今众心已摇不可战战必败请收兵入城禧曰君为大将奈何遇敌不战先自退邪俄夏骑卒度水犯陈	珍白禧曰：今众心已摇，不可战，战必败，请收兵入城。禧曰：君为大将，奈何遇敌不战，先自退邪？俄夏骑卒度水犯陈。	[13, 13, 13, 3, 13, 13, 13, 13, 2, 13, 13, 2, 13, 13, 2, 13, 13, 13, 13, 0, 13, 3, 13, 13, 13, 2, 13, 13, 13, 13, 13, 2, 13, 13, 13, 9, 13, 13, 13, 13, 13, 13, 13, 0]
苦风痹卧帐中决事下不敢欺	苦风痹，卧帐中决事，下不敢欺。	[13, 13, 2, 13, 13, 13, 13, 2, 13, 13, 13, 0]
故时魏州牙兵骄数为乱罗绍威尽诛之	故时，魏州牙兵骄，数为乱，罗绍威尽诛之。	[13, 2, 13, 13, 13, 13, 2, 13, 13, 2, 13, 13, 13, 13, 13, 0]
邓琬性鄙暗贪吝既执大权父子卖官鬻爵使婢仆出市道贩卖酣歌博弈日夜不休大自矜遇宾客到门历旬不得前内事悉委褚灵嗣等三人群小横恣竞为威福于是士民仇怨内外离心	邓琬性鄙暗贪吝，既执大权，父子卖官鬻爵，使婢仆出市道贩卖；酣歌博弈，日夜不休；大自矜遇，宾客到门，历旬不得前；内事悉委褚灵嗣等三人，群小横恣，竞为威福。于是士民仇怨，内外离心。	[13, 13, 13, 13, 13, 13, 2, 13, 13, 13, 2, 13, 13, 13, 13, 13, 2, 13, 13, 13, 13, 13, 13, 13, 1, 13, 13, 13, 2, 13, 13, 13, 1, 13, 13, 13, 2, 13, 13, 13, 2, 13, 13, 13, 13, 1, 13, 13, 13, 13, 13, 13, 13, 13, 13, 2, 13, 13, 13, 2, 13, 13, 13, 0, 13, 13, 13, 13, 13, 2, 13, 13, 13, 0]
越若来二月既死魄越五日甲子朝至接于商则咸刘商王纣执矢恶臣百人	越若来二月既死魄，越五日，甲子朝，至接于商。则咸刘商王纣，执矢恶臣百人。	[13, 13, 13, 13, 13, 13, 13, 2, 13, 13, 2, 13, 13, 2, 13, 13, 13, 0, 13, 13, 13, 13, 13, 2, 13, 13, 13, 13, 13, 0]
是时刘钧尚在	是时刘钧尚在。	[13, 13, 13, 13, 13, 0]
董仲舒表春秋之义稽合於律无乖异者	董仲舒表《春秋》之义，稽合於律，无乖异者。	[13, 13, 13, 10, 13, 11, 13, 2, 13, 13, 13, 2, 13, 13, 13, 0]
望自今刺史非三岁以上不可迁官仍明察功过尤甄赏罚	望自今刺史非三岁以上不可迁官，仍明察功过，尤甄赏罚。	[13, 13, 13, 13, 13, 13, 13, 13, 13, 13, 13, 13, 13, 2, 13, 13, 13, 13, 2, 13, 13, 13, 0]
且陛下以直言召天下士蕡以直言副陛下所问虽讦必容虽过当奖书于史策千古光明	且陛下以直言召天下士，蕡以直言副陛下所问，虽讦必容，虽过当奖，书于史策，千古光明。	[13, 13, 13, 13, 13, 13, 13, 13, 13, 2, 13, 13, 13, 13, 13, 13, 13, 13, 2, 13, 13, 13, 2, 13, 13, 13, 2, 13, 13, 13, 2, 13, 13, 13, 0]
八月日烜弟昭德王陈璨致书于荆湖占城行省自愿纳款归降	八月，日烜弟昭德王陈璨致书于荆湖占城行省，自愿纳款归降。	[13, 2, 13, 13, 13, 13, 13, 13, 13, 13, 13, 13, 13, 13, 13, 13, 13, 13, 2, 13, 13, 13, 13, 13, 0]
世宗即位于辽阳璋劝沙离只归世宗沙离只不从	世宗即位于辽阳，璋劝沙离只归世宗，沙离只不从。	[13, 13, 13, 13, 13, 13, 2, 13, 13, 13, 13, 13, 13, 13, 2, 13, 13, 13, 13, 0]
佞相杀之灭其族国人愤怒	佞相杀之，灭其族，国人愤怒。	[13, 13, 13, 2, 13, 13, 2, 13, 13, 13, 0]
明晨各去遂并活	明晨各去，遂并活。	[13, 13, 13, 2, 13, 13, 0]
天戒若曰兵犹火也不戢将自焚	天戒若曰，兵犹火也，不戢将自焚。	[13, 13, 13, 2, 13, 13, 13, 2, 13, 13, 13, 13, 0]
汉乃召诸将厉之曰吾与诸君逾越险阻转战千里遂深入敌地至其城下而今与刘尚二处受围势既不接其祸难量欲潜师就尚于江南并兵御之	汉乃召诸将厉之曰：吾与诸君逾越险阻，转战千里，遂深入敌地，至其城下，而今与刘尚二处受围，势既不接，其祸难量；欲潜师就尚于江南，并兵御之。	[13, 13, 13, 13, 13, 13, 13, 3, 13, 13, 13, 13, 13, 13, 13, 2, 13, 13, 13, 2, 13, 13, 13, 13, 2, 13, 13, 13, 2, 13, 13, 13, 13, 13, 13, 13, 13, 2, 13, 13, 13, 2, 13, 13, 13, 1, 13, 13, 13, 13, 13, 13, 13, 2, 13, 13, 13, 0]
帝悦诏春和兴工	帝悦，诏春和兴工。	[13, 2, 13, 13, 13, 13, 0]
至高祖为汉王发夷人还伐三秦	至高祖为汉王，发夷人还伐三秦。	[13, 13, 13, 13, 13, 2, 13, 13, 13, 13, 13, 13, 0]
二月刘仁轨大破新罗之众于七重城又使靺鞨浮海略新罗之南境斩获甚众	二月，刘仁轨大破新罗之众于七重城，又使靺鞨浮海略新罗之南境，斩获甚众。	[13, 2, 13, 13, 13, 13, 13, 13, 13, 13, 13, 13, 13, 13, 2, 13, 13, 13, 13, 13, 13, 13, 13, 13, 13, 13, 2, 13, 13, 13, 0]
间者流人奔东吴东吴今俭皆已还反	间者流人奔东吴，东吴今俭，皆已还反。	[13, 13, 13, 13, 13, 13, 2, 13, 13, 13, 2, 13, 13, 13, 0]
今城楚船官地也春秋之渚宫矣	今城，楚船官地也。《春秋》之渚宫矣。	[13, 2, 13, 13, 13, 13, 0, 13, 11, 13, 13, 13, 0]
永乐九年进士选庶吉士寻授检讨	永乐九年进士。选庶吉士，寻授检讨。	[13, 13, 13, 13, 13, 0, 13, 13, 13, 2, 13, 13, 13, 0]
其所令反其所好而民不从	其所令反其所好，而民不从。	[13, 13, 13, 13, 13, 13, 2, 13, 13, 13, 0]
皆王诸将善地而徙逐故主令臣下争畔逆罪七也	皆王诸将善地，而徙逐故主，令臣下争畔逆。罪七也。	[13, 13, 13, 13, 13, 2, 13, 13, 13, 13, 2, 13, 13, 13, 13, 13, 0, 13, 13, 0]
后又欲立子职而绌太子商臣	后又欲立子职而绌太子商臣。	[13, 13, 13, 13, 13, 13, 13, 13, 13, 13, 13, 0]
顷者频年遣使请婚大国陛下复降鸿私许其姻媾	顷者频年遣使，请婚大国，陛下复降鸿私，许其姻媾。	[13, 13, 13, 13, 13, 2, 13, 13, 13, 2, 13, 13, 13, 13, 13, 2, 13, 13, 13, 0]
箕为燕又为吴越齐	箕为燕，又为吴、越、齐。	[13, 13, 2, 13, 13, 8, 8, 0]
神策将李晟自定州率师赴难军于渭桥	神策将李晟自定州率师赴难，军于渭桥。	[13, 13, 13, 13, 13, 13, 13, 13, 13, 13, 13, 2, 13, 13, 13, 0]
馥素性恇怯因然其计	馥素性恇怯，因然其计。	[13, 13, 13, 13, 2, 13, 13, 13, 0]
乐而有节则和平寿考	乐而有节，则和平寿考。	[13, 13, 13, 2, 13, 13, 13, 13, 0]
过在下人君不廉而变则暴人不胜邪乱不止	过在下，人君不廉而变，则暴人不胜，邪乱不止。	[13, 13, 2, 13, 13, 13, 13, 13, 2, 13, 13, 13, 13, 2, 13, 13, 13, 0]
恩日受搒掠濒死者数语卒不变	恩日受搒掠，濒死者数，语卒不变。	[13, 13, 13, 13, 2, 13, 13, 13, 2, 13, 13, 13, 0]
还为始安内史	还为始安内史。	[13, 13, 13, 13, 13, 0]
酌膳执幂如初以酢主人于西阶上主人北面拜受爵	酌膳、执幂如初，以酢主人于西阶上。主人北面拜受爵。	[13, 8, 13, 13, 13, 2, 13, 13, 13, 13, 13, 13, 13, 0, 13, 13, 13, 13, 13, 13, 0]
河南刘崇远崇龟从弟也有妹为尼居楚州常有一客尼寓宿忽病劳瘦甚且死	河南刘崇远，崇龟从弟也，有妹为尼，居楚州。常有一客尼寓宿，忽病劳，瘦甚且死。	[13, 13, 13, 13, 2, 13, 13, 13, 13, 2, 13, 13, 13, 2, 13, 13, 0, 13, 13, 13, 13, 13, 13, 2, 13, 13, 2, 13, 13, 13, 0]
寻副毛鸿宾镇潼关加前将军太中大夫	寻副毛鸿宾镇潼关，加前将军、太中大夫。	[13, 13, 13, 13, 13, 13, 13, 2, 13, 13, 13, 8, 13, 13, 13, 0]
明知百僚卿尹虽各有所司然其治民之本莫若宰守之最重也	明知百僚卿尹，虽各有所司，然其治民之本，莫若宰守之最重也。	[13, 13, 13, 13, 13, 2, 13, 13, 13, 13, 2, 13, 13, 13, 13, 13, 2, 13, 13, 13, 13, 13, 13, 13, 0]
占曰兵起岁中旱	占曰：兵起，岁中旱。	[13, 3, 13, 2, 13, 13, 0]
酒解可覆奏	酒解，可覆奏。	[13, 2, 13, 13, 0]
春二月戊午司徒种暠薨	春，二月，戊午，司徒种暠薨。	[2, 13, 2, 13, 2, 13, 13, 13, 13, 0]
除夏秋税省耗	除夏、秋税省耗。	[13, 8, 13, 13, 13, 0]
父万袭爵位梁州镇将赠冀州刺史	父万袭爵，位梁州镇将，赠冀州刺史。	[13, 13, 13, 2, 13, 13, 13, 13, 2, 13, 13, 13, 13, 0]
千乘之国封天财之所殖诫器之所出财物之所生视岁之满虚而轻重其禄然后千乘可足也	千乘之国，封天财之所殖，诫器之所出，财物之所生，视岁之满虚而轻重其禄，然后千乘可足也。	[13, 13, 13, 2, 13, 13, 13, 13, 13, 2, 13, 13, 13, 13, 2, 13, 13, 13, 13, 2, 13, 13, 13, 13, 13, 13, 13, 13, 13, 2, 13, 13, 13, 13, 13, 13, 0]
十九年立国子学以本官领国子博士皇太子讲孝经承天与中庶子颜延之同为执经	十九年，立国子学，以本官领国子博士。皇太子讲《孝经》，承天与中庶子颜延之同为执经。	[13, 13, 2, 13, 13, 13, 2, 13, 13, 13, 13, 13, 13, 13, 0, 13, 13, 13, 10, 13, 11, 13, 13, 13, 13, 13, 13, 13, 13, 13, 13, 13, 13, 0]
初代宗喜祠祀未甚重佛而元载杜鸿渐与缙喜饭僧徒	初，代宗喜祠祀，未甚重佛，而元载、杜鸿渐与缙喜饭僧徒。	[2, 13, 13, 13, 13, 2, 13, 13, 13, 2, 13, 13, 8, 13, 13, 13, 13, 13, 13, 13, 13, 0]
然绠短者衔渴足疲者辍途非文理之数尽乃通变之术疏耳	然绠短者衔渴，足疲者辍途，非文理之数尽，乃通变之术疏耳。	[13, 13, 13, 13, 13, 2, 13, 13, 13, 13, 2, 13, 13, 13, 13, 13, 2, 13, 13, 13, 13, 13, 13, 0]
大业未融山隤奄及悼伤既切宜崇茂典	大业未融，山隤奄及，悼伤既切，宜崇茂典。	[13, 13, 13, 2, 13, 13, 13, 2, 13, 13, 13, 2, 13, 13, 13, 0]
王曰不知也	王曰：不知也。	[13, 3, 13, 13, 0]
秋七月壬寅柱国随国公杨忠薨	秋七月壬寅，柱国、随国公杨忠薨。	[13, 13, 13, 13, 2, 13, 8, 13, 13, 13, 13, 13, 0]
予曰惩劝之道人神一也	予曰：惩劝之道，人神一也。	[13, 3, 13, 13, 13, 2, 13, 13, 13, 0]
又北四百里曰乾山无草木其阳有金玉其阴有铁而无水	又北四百里，曰乾山，无草木，其阳有金玉，其阴有铁而无水。	[13, 13, 13, 13, 2, 13, 13, 2, 13, 13, 2, 13, 13, 13, 13, 2, 13, 13, 13, 13, 13, 13, 0]
四人年老矣皆以上嫚娒士故逃匿山中义不为汉臣	四人年老矣，皆以上嫚娒士，故逃匿山中，义不为汉臣。	[13, 13, 13, 13, 2, 13, 13, 13, 13, 13, 2, 13, 13, 13, 13, 2, 13, 13, 13, 13, 0]
初侃长子鷟爲景所获执来城下示侃	初，侃长子鷟爲景所获，执来城下示侃。	[2, 13, 13, 13, 13, 13, 13, 13, 2, 13, 13, 13, 13, 13, 0]
起为云麾将军吴郡太守	起为云麾将军、吴郡太守。	[13, 13, 13, 13, 13, 8, 13, 13, 13, 0]
诏殿中尚书长孙真率骑五千自石济渡备玄谟遁走	诏殿中尚书长孙真率骑五千自石济渡，备玄谟遁走。	[13, 13, 13, 13, 13, 13, 13, 13, 13, 13, 13, 13, 13, 13, 13, 2, 13, 13, 13, 13, 0]
二人每进见上辄为之起去则临轩送之	二人每进见，上辄为之起，去则临轩送之。	[13, 13, 13, 13, 2, 13, 13, 13, 13, 2, 13, 13, 13, 13, 13, 0]
帝命阇里毕与皇太弟国王分拨诸侯王城邑谕阇里毕曰汉人中若王宣抚者可任使之	帝命阇里毕与皇太弟国王分拨诸侯王城邑，谕阇里毕曰：汉人中若王宣抚者，可任使之。	[13, 13, 13, 13, 13, 13, 13, 13, 13, 13, 13, 13, 13, 13, 13, 13, 13, 2, 13, 13, 13, 13, 3, 13, 13, 13, 13, 13, 13, 13, 2, 13, 13, 13, 0]
忆余二十年前同云峰自桃源来溯其外涧入未深穷其窟奥	忆余二十年前，同云峰自桃源来，溯其外涧入，未深穷其窟奥。	[13, 13, 13, 13, 13, 2, 13, 13, 13, 13, 13, 13, 2, 13, 13, 13, 13, 2, 13, 13, 13, 13, 13, 0]
建安三年袁绍复大攻瓚	建安三年，袁绍复大攻瓚。	[13, 13, 13, 2, 13, 13, 13, 13, 13, 0]
反间者因其敌间而用之	反间者，因其敌间而用之。	[13, 13, 2, 13, 13, 13, 13, 13, 13, 0]
引铨有选人系百钱于靴带上	引铨，有选人系百钱于靴带上。	[13, 2, 13, 13, 13, 13, 13, 13, 13, 13, 13, 0]
主人柩东西面	主人柩东，西面。	[13, 13, 13, 2, 13, 0]
五年遣濙颁御制诸书并访仙人张邋遢遍行天下州郡乡邑隐察建文帝安在	五年遣濙颁御制诸书，并访仙人张邋遢，遍行天下州郡乡邑，隐察建文帝安在。	[13, 13, 13, 13, 13, 13, 13, 13, 2, 13, 13, 13, 13, 13, 13, 2, 13, 13, 13, 13, 13, 13, 13, 2, 13, 13, 13, 13, 13, 13, 0]
于是空国入寇	于是空国入寇。	[13, 13, 13, 13, 13, 0]
朕自行礼九年置官三载正欲开导兆人致之礼教	朕自行礼九年，置官三载，正欲开导兆人，致之礼教。	[13, 13, 13, 13, 13, 2, 13, 13, 13, 2, 13, 13, 13, 13, 13, 2, 13, 13, 13, 0]
帝以媪前倨后恭诘之曰公贵不可言也	帝以媪前倨后恭，诘之，曰：公贵不可言也。	[13, 13, 13, 13, 13, 13, 2, 13, 2, 3, 13, 13, 13, 13, 13, 0]
好学有思理练悉朝典	好学，有思理，练悉朝典。	[13, 2, 13, 13, 2, 13, 13, 13, 0]
须臾复一出济受诏又射杀之六军大叫称快	须臾复一出，济受诏又射杀之，六军大叫称快。	[13, 13, 13, 13, 2, 13, 13, 13, 13, 13, 13, 2, 13, 13, 13, 13, 13, 0]
忿怒之人呴呼於人之旁口气喘射人之面虽勇如贲育气不害人使舒手而击举足而蹶则所击蹶无不破折	忿怒之人，呴呼於人之旁，口气喘射人之面，虽勇如贲、育，气不害人，使舒手而击，举足而蹶，则所击蹶无不破折。	[13, 13, 13, 2, 13, 13, 13, 13, 13, 2, 13, 13, 13, 13, 13, 13, 2, 13, 13, 13, 8, 2, 13, 13, 13, 2, 13, 13, 13, 13, 2, 13, 13, 13, 2, 13, 13, 13, 13, 13, 13, 13, 0]
溍年始六十七不俟引年亟上纳禄侍亲之请绝江径归	溍年始六十七，不俟引年，亟上纳禄侍亲之请，绝江径归。	[13, 13, 13, 13, 13, 2, 13, 13, 13, 2, 13, 13, 13, 13, 13, 13, 13, 2, 13, 13, 13, 0]
陛下必欲委弃尘务则皇太子宜承正统	陛下必欲委弃尘务，则皇太子宜承正统。	[13, 13, 13, 13, 13, 13, 13, 2, 13, 13, 13, 13, 13, 13, 13, 0]
礼毕翰林官以诏书授礼部官礼部官奉诏书于承天门开读	礼毕，翰林官以诏书授礼部官，礼部官奉诏书于承天门开读。	[13, 2, 13, 13, 13, 13, 13, 13, 13, 13, 13, 2, 13, 13, 13, 13, 13, 13, 13, 13, 13, 13, 13, 0]
起知泉州告老加大学士致仕	起知泉州，告老，加大学士致仕。	[13, 13, 13, 2, 13, 2, 13, 13, 13, 13, 13, 0]
故吏侯文以刚直不苟合常称疾不肯仕宝以恩礼请文欲为布衣友日设酒食妻子相对	故吏侯文以刚直不苟合，常称疾不肯仕，宝以恩礼请文，欲为布衣友，日设酒食，妻子相对。	[13, 13, 13, 13, 13, 13, 13, 13, 13, 2, 13, 13, 13, 13, 13, 2, 13, 13, 13, 13, 13, 2, 13, 13, 13, 13, 2, 13, 13, 13, 2, 13, 13, 13, 0]
南单于拔死弟休利立为去特若尸逐就单于	南单于拔死，弟休利立，为去特若尸逐就单于。	[13, 13, 13, 13, 2, 13, 13, 13, 2, 13, 13, 13, 13, 13, 13, 13, 13, 0]
