original	target	ner_tag
辛丑至修陵	辛丑，至修陵。	[13, 2, 13, 13, 0]
注称嫡子冠于阼庶子冠于房	注称嫡子冠于阼，庶子冠于房。	[13, 13, 13, 13, 13, 13, 2, 13, 13, 13, 13, 0]
又房玄龄夫人至妒	又房玄龄夫人至妒。	[13, 13, 13, 13, 13, 13, 13, 0]
朕以大冕纯玉缫玄衣黄裳乘玉辂郊祀天宗祀明堂	朕以大冕纯玉缫，玄衣黄裳，乘玉辂，郊祀天，宗祀明堂。	[13, 13, 13, 13, 13, 13, 2, 13, 13, 13, 2, 13, 13, 2, 13, 13, 2, 13, 13, 13, 0]
今光等以庚申为非甲寅为是	今光等以庚申为非，甲寅为是。	[13, 13, 13, 13, 13, 13, 13, 2, 13, 13, 13, 0]
案刘向说桑者丧也又为哭声不祥之甚	案刘向说，桑者丧也，又为哭声，不祥之甚。	[13, 13, 13, 2, 13, 13, 13, 2, 13, 13, 13, 2, 13, 13, 13, 0]
钦子鸯及虎将兵在小城中闻钦死勒兵驰赴之众不为用	钦子鸯及虎将兵在小城中，闻钦死，勒兵驰赴之，众不为用。	[13, 13, 13, 13, 13, 13, 13, 13, 13, 13, 2, 13, 13, 2, 13, 13, 13, 13, 2, 13, 13, 13, 0]
明帝泰始二年四月地震	明帝泰始二年四月，地震。	[13, 13, 13, 13, 13, 13, 13, 2, 13, 0]
壬申以月失察儿知枢密院事	壬申，以月失察儿知枢密院事。	[13, 2, 13, 13, 13, 13, 13, 13, 13, 13, 13, 0]
苍颉造之鬼哭粟飞黄帝用之官治民察	苍颉造之，鬼哭粟飞；黄帝用之，官治民察。	[13, 13, 13, 2, 13, 13, 13, 1, 13, 13, 13, 2, 13, 13, 13, 0]
友珪立硃友谦叛附于晋西连凤翔存节东西受敌	友珪立，硃友谦叛附于晋，西连凤翔，存节东西受敌。	[13, 13, 2, 13, 13, 13, 13, 13, 13, 2, 13, 13, 13, 2, 13, 13, 13, 13, 13, 0]
且所生之子远寄人家其人皆言狐生不给衣食岂不念乎	且所生之子，远寄人家，其人皆言狐生，不给衣食，岂不念乎？	[13, 13, 13, 13, 2, 13, 13, 13, 2, 13, 13, 13, 13, 13, 2, 13, 13, 13, 2, 13, 13, 13, 9]
朕永惟祖考遗志思在绥缉四海率土同轨故爰整六师耀威梁益	朕永惟祖考遗志，思在绥缉四海，率土同轨，故爰整六师，耀威梁、益。	[13, 13, 13, 13, 13, 13, 2, 13, 13, 13, 13, 13, 2, 13, 13, 13, 2, 13, 13, 13, 13, 2, 13, 13, 8, 0]
何以知义之不从愚且贱者出而必自贵且知者出也	何以知义之不从愚且贱者出，而必自贵且知者出也？	[13, 13, 13, 13, 13, 13, 13, 13, 13, 13, 13, 2, 13, 13, 13, 13, 13, 13, 13, 13, 9]
臣闻长老之谈皆谓台谏所言常随天下公议	臣闻长老之谈，皆谓台谏所言，常随天下公议。	[13, 13, 13, 13, 13, 2, 13, 13, 13, 13, 13, 2, 13, 13, 13, 13, 13, 0]
猎遣张荣将兵援竟陵又招神马陂溃卒得万人分援襄阳德安	猎遣张荣将兵援竟陵，又招神马陂溃卒得万人，分援襄阳、德安。	[13, 13, 13, 13, 13, 13, 13, 13, 2, 13, 13, 13, 13, 13, 13, 13, 13, 13, 2, 13, 13, 13, 8, 13, 0]
适百岁矣	适百岁矣。	[13, 13, 13, 0]
红髹椅一纳板一并褥	红髹椅一，纳板一并褥。	[13, 13, 13, 2, 13, 13, 13, 13, 0]
常诫守者吾以自检故书无条理勿令至尊见之	常诫守者：吾以自检，故书无条理，勿令至尊见之。	[13, 13, 13, 3, 13, 13, 13, 2, 13, 13, 13, 13, 2, 13, 13, 13, 13, 13, 0]
庄宗不乐称疾不食者累日	庄宗不乐，称疾不食者累日。	[13, 13, 13, 2, 13, 13, 13, 13, 13, 13, 0]
突厥咎周人曰尔言齐乱故来伐之	突厥咎周人曰：尔言齐乱，故来伐之。	[13, 13, 13, 13, 13, 3, 13, 13, 13, 2, 13, 13, 13, 0]
距义阳百余里众以魏军盛趑趄莫敢前	距义阳百余里，众以魏军盛，趑趄莫敢前。	[13, 13, 13, 13, 13, 2, 13, 13, 13, 13, 2, 13, 13, 13, 13, 0]
臣任刺史罪无所逃	臣任刺史，罪无所逃。	[13, 13, 13, 2, 13, 13, 13, 0]
梁坊匠张韶反幸左神策军韶伏诛	梁坊匠张韶反，幸左神策军，韶伏诛。	[13, 13, 13, 13, 13, 2, 13, 13, 13, 13, 2, 13, 13, 0]
日南郡秦置象郡汉武帝改名焉	日南郡秦置象郡，汉武帝改名焉。	[13, 13, 13, 13, 13, 13, 2, 13, 13, 13, 13, 13, 0]
复梦书皎皎白驹字或曰过隙也	复梦书皎皎白驹字，或曰过隙也。	[13, 13, 13, 13, 13, 13, 13, 2, 13, 13, 13, 13, 0]
乙丑阿里愿自修船同张存从征瓜哇军往招占城甘不察诏授阿里三珠虎符张存一珠虎符仍蠲阿里父布伯所负斡脱钞三千锭	乙丑，阿里愿自修船，同张存从征瓜哇军，往招占城、甘不察，诏授阿里三珠虎符，张存一珠虎符，仍蠲阿里父布伯所负斡脱钞三千锭。	[13, 2, 13, 13, 13, 13, 13, 2, 13, 13, 13, 13, 13, 13, 13, 2, 13, 13, 13, 8, 13, 13, 2, 13, 13, 13, 13, 13, 13, 13, 2, 13, 13, 13, 13, 13, 2, 13, 13, 13, 13, 13, 13, 13, 13, 13, 13, 13, 13, 13, 13, 0]
神怒民畔何以能久	神怒民畔，何以能久？	[13, 13, 13, 2, 13, 13, 13, 9]
景初元年十月丁未月犯荧惑	景初元年十月丁未，月犯荧惑。	[13, 13, 13, 13, 13, 13, 13, 2, 13, 13, 13, 0]
穰侯怒曰何也	穰侯怒曰：何也？	[13, 13, 13, 3, 13, 9]
既富矣则仁义兴焉既安矣则寿考至焉	既富矣，则仁义兴焉；既安矣，则寿考至焉。	[13, 13, 2, 13, 13, 13, 13, 1, 13, 13, 2, 13, 13, 13, 13, 0]
魏主方谋取关中得虎甚喜拜卫将军厚赐之使就泰	魏主方谋取关中，得虎甚喜，拜卫将军，厚赐之，使就泰。	[13, 13, 13, 13, 13, 13, 2, 13, 13, 13, 2, 13, 13, 13, 2, 13, 13, 2, 13, 13, 0]
时有长星色白有芒鬣自襄平城西南流于东北坠于梁水城中震慑	时有长星，色白，有芒鬣，自襄平城西南流于东北，坠于梁水，城中震慑。	[13, 13, 13, 2, 13, 2, 13, 13, 2, 13, 13, 13, 13, 13, 13, 13, 13, 13, 2, 13, 13, 13, 2, 13, 13, 13, 0]
居建成山中依林阻为室独宿无侣	居建成山中，依林阻为室，独宿无侣。	[13, 13, 13, 13, 2, 13, 13, 13, 13, 2, 13, 13, 13, 0]
高幼有识慧四岁丧父与群儿同处独不戏弄	高幼有识慧，四岁丧父，与群儿同处，独不戏弄。	[13, 13, 13, 13, 13, 2, 13, 13, 13, 2, 13, 13, 13, 13, 2, 13, 13, 13, 0]
甲辰马全节自应山县进军于大化镇	甲辰，马全节自应山县进军于大化镇。	[13, 2, 13, 13, 13, 13, 13, 13, 13, 13, 13, 13, 13, 13, 0]
对曰名器不可假也	对曰：名器不可假也。	[13, 3, 13, 13, 13, 13, 13, 0]
世宗孝武皇帝上之上建元二年冬十月淮南王安来朝	世宗孝武皇帝上之上建元二年冬，十月，淮南王安来朝。	[13, 13, 13, 13, 13, 13, 13, 13, 13, 13, 13, 13, 13, 2, 13, 2, 13, 13, 13, 13, 13, 0]
况今旱暵方甚圣慈降膳乃以万五千人使杨钧为将而欲定蠕蠕干时而动其可济乎	况今旱暵方甚，圣慈降膳，乃以万五千人使杨钧为将，而欲定蠕蠕干时而动，其可济乎！	[13, 13, 13, 13, 13, 2, 13, 13, 13, 2, 13, 13, 13, 13, 13, 13, 13, 13, 13, 13, 2, 13, 13, 13, 13, 13, 13, 13, 13, 2, 13, 13, 13, 12]
宋使赵良嗣来请加岁币以代燕税及议画疆与遣使贺正旦生辰置榷场交易并计议西京等事	宋使赵良嗣来，请加岁币以代燕税，及议画疆与遣使贺正旦生辰、置榷场交易，并计议西京等事。	[13, 13, 13, 13, 13, 2, 13, 13, 13, 13, 13, 13, 13, 2, 13, 13, 13, 13, 13, 13, 13, 13, 13, 13, 13, 8, 13, 13, 13, 13, 2, 13, 13, 13, 13, 13, 13, 0]
东至小南门三江合处约舟待于兴安	东至小南门，三江合处。约舟待于兴安。	[13, 13, 13, 13, 2, 13, 13, 13, 0, 13, 13, 13, 13, 13, 0]
及文襄遇难文宣将赴晋阳黄门郎阳休之劝季舒从行曰一日不朝其闲容刀季舒性爱声色心在闲放遂不请行欲恣其行乐	及文襄遇难，文宣将赴晋阳，黄门郎阳休之劝季舒从行，曰：一日不朝，其闲容刀。季舒性爱声色，心在闲放，遂不请行，欲恣其行乐。	[13, 13, 13, 13, 2, 13, 13, 13, 13, 13, 2, 13, 13, 13, 13, 13, 13, 13, 13, 13, 13, 2, 3, 13, 13, 13, 2, 13, 13, 13, 0, 13, 13, 13, 13, 13, 2, 13, 13, 13, 2, 13, 13, 13, 2, 13, 13, 13, 13, 0]
光明洁白可照一室	光明洁白，可照一室。	[13, 13, 13, 2, 13, 13, 13, 0]
子产曰雖可吾不足以定迁矣	子产曰：雖可，吾不足以定迁矣。	[13, 13, 3, 13, 2, 13, 13, 13, 13, 13, 13, 0]
敢误成事谔曰城之必败败则死拒节制亦死死于此犹愈于丧国师而沦异域也禧度不可屈奏谔跋扈异议诏谔守延州	敢误成事。谔曰：城之必败，败则死，拒节制亦死；死于此，犹愈于丧国师而沦异域也。禧度不可屈，奏谔跋扈异议，诏谔守延州。	[13, 13, 13, 0, 13, 3, 13, 13, 13, 2, 13, 13, 2, 13, 13, 13, 13, 1, 13, 13, 2, 13, 13, 13, 13, 13, 13, 13, 13, 13, 13, 0, 13, 13, 13, 13, 2, 13, 13, 13, 13, 13, 2, 13, 13, 13, 13, 0]
知不知尚矣不知知病也	知不知，尚矣；不知知，病也。	[13, 13, 2, 13, 1, 13, 13, 2, 13, 0]
敕天下无得棰曳僧尼造金阁寺于五台山铸铜涂金为瓦所费巨亿缙给中书符牒令五台僧数十人散之四方求利以营之	敕天下无得棰曳僧尼。造金阁寺于五台山，铸铜涂金为瓦，所费巨亿，缙给中书符牒，令五台僧数十人散之四方，求利以营之。	[13, 13, 13, 13, 13, 13, 13, 13, 0, 13, 13, 13, 13, 13, 13, 13, 2, 13, 13, 13, 13, 13, 2, 13, 13, 13, 2, 13, 13, 13, 13, 13, 2, 13, 13, 13, 13, 13, 13, 13, 13, 13, 13, 2, 13, 13, 13, 13, 0]
范仲淹以言事贬在廷多论救司谏高若讷独以为当黜	范仲淹以言事贬，在廷多论救，司谏高若讷独以为当黜。	[13, 13, 13, 13, 13, 13, 2, 13, 13, 13, 13, 2, 13, 13, 13, 13, 13, 13, 13, 13, 13, 0]
路溯溪南山峡逼仄时攀石上下二里余乃西渡此水	路溯溪南，山峡逼仄，时攀石上下，二里余，乃西渡此水。	[13, 13, 13, 2, 13, 13, 13, 2, 13, 13, 13, 13, 2, 13, 13, 2, 13, 13, 13, 13, 0]
唯无盐氏出捐千金贷其息什之	唯无盐氏出捐千金贷，其息什之。	[13, 13, 13, 13, 13, 13, 13, 13, 2, 13, 13, 13, 0]
为利故必致死而争之非急故不得已而战	为利，故必致死而争之；非急，故不得已而战。	[13, 2, 13, 13, 13, 13, 13, 13, 1, 13, 2, 13, 13, 13, 13, 13, 0]
脉浅者勿刺按绝其脉乃刺之无令精出独出其邪气耳	脉浅者，勿刺，按绝其脉乃刺之，无令精出，独出其邪气耳。	[13, 13, 2, 13, 2, 13, 13, 13, 13, 13, 13, 2, 13, 13, 13, 2, 13, 13, 13, 13, 13, 0]
至字干附初封崇业公后袭穆公爵	至字干附。初封崇业公，后袭穆公爵。	[13, 13, 13, 0, 13, 13, 13, 13, 2, 13, 13, 13, 13, 0]
伊伐于虑鞮单于汗中元二年立	伊伐于虑鞮单于汗，中元二年立。	[13, 13, 13, 13, 13, 13, 13, 2, 13, 13, 13, 13, 0]
郡国志曰长平故属汝南县有赭丘城即此城也	《郡国志》曰：长平故属汝南县，有赭丘城，即此城也。	[13, 13, 11, 3, 13, 13, 13, 13, 13, 13, 2, 13, 13, 13, 2, 13, 13, 13, 0]
诏贷被灾诸郡民种粮	诏贷被灾诸郡民种粮。	[13, 13, 13, 13, 13, 13, 13, 13, 0]
于时高肇当朝猜忌贤戚	于时高肇当朝，猜忌贤戚。	[13, 13, 13, 13, 13, 2, 13, 13, 13, 0]
未几镇甘肃	未几，镇甘肃。	[13, 2, 13, 13, 0]
而锦衣卫主巡察缉捕理诏狱以都督都指挥领之盖特异于诸卫焉	而锦衣卫主巡察、缉捕、理诏狱，以都督、都指挥领之，盖特异于诸卫焉。	[13, 13, 13, 13, 13, 13, 8, 13, 8, 13, 13, 2, 13, 13, 8, 13, 13, 13, 13, 2, 13, 13, 13, 13, 13, 13, 0]
当时朝廷大手笔多是行功及兰台侍郎李怀俨之词	当时朝廷大手笔，多是行功及兰台侍郎李怀俨之词。	[13, 13, 13, 13, 13, 13, 2, 13, 13, 13, 13, 13, 13, 13, 13, 13, 13, 13, 13, 13, 0]
一时不雨恐惧雩祭求有请福忧念百性也	一时不雨，恐惧雩祭，求有请福，忧念百性也。	[13, 13, 13, 2, 13, 13, 13, 2, 13, 13, 13, 2, 13, 13, 13, 13, 0]
毅曰峤虽寝苫食粥乃生孝耳	毅曰：峤虽寝苫食粥，乃生孝耳。	[13, 3, 13, 13, 13, 13, 13, 2, 13, 13, 13, 0]
冬十月壬午楚师灭陈	冬十月壬午，楚师灭陈。	[13, 13, 13, 13, 2, 13, 13, 13, 0]
东海之鳖左足未入而右膝已絷矣	东海之鳖左足未入，而右膝已絷矣。	[13, 13, 13, 13, 13, 13, 13, 2, 13, 13, 13, 13, 13, 0]
太平遂往	太平遂往。	[13, 13, 13, 0]
周天元如同州	周天元如同州。	[13, 13, 13, 13, 13, 0]
滔以救魏博之故叛君弃兄如脱屣耳	滔以救魏博之故，叛君弃兄，如脱屣耳。	[13, 13, 13, 13, 13, 13, 2, 13, 13, 13, 2, 13, 13, 13, 0]
五年春擢署都督佥事代郭成为总兵官镇守广东	五年春，擢署都督佥事，代郭成为总兵官，镇守广东。	[13, 13, 2, 13, 13, 13, 13, 13, 2, 13, 13, 13, 13, 13, 13, 2, 13, 13, 13, 0]
吾虽不敏实有本志庶得遵奉斯义不敢坠失	吾虽不敏，实有本志，庶得遵奉斯义，不敢坠失。	[13, 13, 13, 2, 13, 13, 13, 2, 13, 13, 13, 13, 13, 2, 13, 13, 13, 0]
以马驴及他赍为贽当日成亲毕留阎侯止王氏仁亶独往主人赠送之其后数年仁亶迁侍御史并州长史御史大夫知政事后庚累遇提挈竟至一州	以马驴及他赍为贽，当日成亲毕，留阎侯止王氏，仁亶独往，主人赠送之。其后数年，仁亶迁侍御史、并州长史、御史大夫知政事，后庚累遇提挈，竟至一州。	[13, 13, 13, 13, 13, 13, 13, 2, 13, 13, 13, 13, 2, 13, 13, 13, 13, 13, 2, 13, 13, 13, 2, 13, 13, 13, 13, 0, 13, 13, 13, 2, 13, 13, 13, 13, 13, 8, 13, 13, 13, 8, 13, 13, 13, 13, 13, 13, 2, 13, 13, 13, 13, 13, 2, 13, 13, 13, 0]
海内忧危虑移宗社	海内忧危，虑移宗社。	[13, 13, 13, 2, 13, 13, 13, 0]
遂击破八能乘胜袭穰城辛纂勒兵出战大败还趣城	遂击破八能，乘胜袭穰城；辛纂勒兵出战，大败，还趣城。	[13, 13, 13, 13, 2, 13, 13, 13, 13, 1, 13, 13, 13, 13, 13, 2, 13, 2, 13, 13, 0]
唯强饭自爱珍重珍重	唯强饭自爱，珍重珍重。	[13, 13, 13, 13, 2, 13, 13, 13, 0]
子罕还泣谓母曰儿欲移五步亦不得与囚何异	子罕还，泣谓母曰：儿欲移五步亦不得，与囚何异！	[13, 13, 2, 13, 13, 13, 3, 13, 13, 13, 13, 13, 13, 13, 2, 13, 13, 13, 12]
臣愿得勇敢之士五千人不赍斗粮饥食虏肉渴饮其血可以横行	臣愿得勇敢之士五千人，不赍斗粮，饥食虏肉，渴饮其血，可以横行！	[13, 13, 13, 13, 13, 13, 13, 13, 13, 2, 13, 13, 13, 2, 13, 13, 13, 2, 13, 13, 13, 2, 13, 13, 13, 12]
君之行也岁在大火	君之行也，岁在大火。	[13, 13, 13, 2, 13, 13, 13, 0]
天顺初石亨谮之下吏考讯无验出为武陟知县	天顺初，石亨谮之下吏，考讯无验，出为武陟知县。	[13, 13, 2, 13, 13, 13, 13, 13, 2, 13, 13, 13, 2, 13, 13, 13, 13, 13, 0]
大将军秉事用权五侯骄奢僣盛并作威福击断自恣行污而寄治身私而托公依东宫之尊假甥舅之亲以为威重	大将军秉事用权，五侯骄奢僣盛，并作威福，击断自恣，行污而寄治，身私而托公，依东宫之尊，假甥舅之亲，以为威重。	[13, 13, 13, 13, 13, 13, 2, 13, 13, 13, 13, 13, 2, 13, 13, 13, 2, 13, 13, 13, 2, 13, 13, 13, 13, 2, 13, 13, 13, 13, 2, 13, 13, 13, 13, 2, 13, 13, 13, 13, 2, 13, 13, 13, 0]
甲戌泾阳获毛龟	甲戌，泾阳获毛龟。	[13, 2, 13, 13, 13, 13, 0]
仁宗初光禄卿井泉奏岁例遣正官往南京采玉面狸帝叱之曰小人不达政体	仁宗初，光禄卿井泉奏，岁例遣正官往南京采玉面狸，帝叱之曰：小人不达政体。	[13, 13, 2, 13, 13, 13, 13, 13, 2, 13, 13, 13, 13, 13, 13, 13, 13, 13, 13, 13, 2, 13, 13, 13, 3, 13, 13, 13, 13, 13, 0]
特授中议大夫袭封衍圣公月俸百缗加至五百缗赐四品印	特授中议大夫，袭封衍圣公，月俸百缗，加至五百缗，赐四品印。	[13, 13, 13, 13, 13, 2, 13, 13, 13, 13, 2, 13, 13, 13, 2, 13, 13, 13, 13, 2, 13, 13, 13, 0]
令地方一里为井井十为通通十为成成方十里	令地方一里为井，井十为通，通十为成，成方十里。	[13, 13, 13, 13, 13, 13, 2, 13, 13, 13, 2, 13, 13, 13, 2, 13, 13, 13, 0]
陈氏亦曰岂敢他心哉但得衣食粗充夫人不至怪怒是某本意	陈氏亦曰：岂敢他心哉，但得衣食粗充，夫人不至怪怒，是某本意。	[13, 13, 13, 3, 13, 13, 13, 13, 2, 13, 13, 13, 13, 13, 2, 13, 13, 13, 13, 13, 2, 13, 13, 13, 0]
且循法无过修礼无邪臣愿王之图之	且循法无过，修礼无邪，臣愿王之图之。	[13, 13, 13, 13, 2, 13, 13, 13, 2, 13, 13, 13, 13, 13, 0]
诏以先为安东将军常宿于内以备顾问	诏以先为安东将军，常宿于内，以备顾问。	[13, 13, 13, 13, 13, 13, 13, 2, 13, 13, 13, 2, 13, 13, 13, 0]
永明中至平西司马陈留太守卒官	永明中，至平西司马、陈留太守，卒官。	[13, 13, 2, 13, 13, 13, 13, 8, 13, 13, 13, 2, 13, 0]
知子莫如父诚哉长者之言	知子莫如父，诚哉长者之言。	[13, 13, 13, 13, 2, 13, 13, 13, 13, 13, 0]
帝使刘桃枝将禁兵八十人召俨桃枝遥拜俨命反缚将斩之禁兵散走	帝使刘桃枝将禁兵八十人召俨，桃枝遥拜。俨命反缚，将斩之，禁兵散走。	[13, 13, 13, 13, 13, 13, 13, 13, 13, 13, 13, 13, 2, 13, 13, 13, 0, 13, 13, 13, 2, 13, 13, 2, 13, 13, 13, 0]
以多问寡焯为师首	以多问寡，焯为师首。	[13, 13, 13, 2, 13, 13, 13, 0]
公孙举东郭窦等聚众至三万人寇青兗徐三州破坏郡县	公孙举、东郭窦等聚众至三万人，寇青、兗、徐三州，破坏郡县。	[13, 13, 8, 13, 13, 13, 13, 13, 13, 13, 13, 13, 2, 13, 8, 8, 13, 13, 2, 13, 13, 13, 0]
初不奏闻窃有所虑因又焚之	初不奏闻，窃有所虑，因又焚之。	[13, 13, 13, 2, 13, 13, 13, 2, 13, 13, 13, 0]
时太尉张禹留守闻车驾当幸江陵以为不宜冒险远游驿马上谏	时太尉张禹留守，闻车驾当幸江陵，以为不宜冒险远游，驿马上谏。	[13, 13, 13, 13, 13, 13, 2, 13, 13, 13, 13, 13, 13, 2, 13, 13, 13, 13, 13, 13, 13, 2, 13, 13, 13, 0]
云为兄作主人	云：为兄作主人。	[3, 13, 13, 13, 13, 0]
戊戌富弼以司空致仕进封韩国公	戊戌，富弼以司空致仕，进封韩国公。	[13, 2, 13, 13, 13, 13, 13, 13, 2, 13, 13, 13, 13, 0]
吾子孙其覆亡之不暇而况能禋祀许乎	吾子孙其覆亡之不暇，而况能禋祀许乎？	[13, 13, 13, 13, 13, 13, 13, 13, 2, 13, 13, 13, 13, 13, 13, 9]
复以国弟广举并为中郎将	复以国弟广、举并为中郎将。	[13, 13, 13, 13, 8, 13, 13, 13, 13, 13, 0]
世祖大悦谓公卿曰吾意决矣	世祖大悦，谓公卿曰：吾意决矣。	[13, 13, 13, 2, 13, 13, 13, 3, 13, 13, 13, 0]
乙未京师及莫州地震	乙未，京师及莫州地震。	[13, 2, 13, 13, 13, 13, 13, 13, 0]
以书示行周行周上表谢恩	以书示行周，行周上表谢恩。	[13, 13, 13, 13, 2, 13, 13, 13, 13, 13, 0]
及会败议者以为知言	及会败，议者以为知言。	[13, 13, 2, 13, 13, 13, 13, 13, 0]
炀帝世累迁至江都郡丞	炀帝世，累迁至江都郡丞。	[13, 13, 2, 13, 13, 13, 13, 13, 13, 0]
翌日又从周文与齐神武战河桥身被七创遂为所获阳陨绝于地睨其傍有马因跃上得免	翌日，又从周文与齐神武战河桥，身被七创，遂为所获，阳陨绝于地，睨其傍有马，因跃上得免。	[13, 2, 13, 13, 13, 13, 13, 13, 13, 13, 13, 13, 2, 13, 13, 13, 2, 13, 13, 13, 2, 13, 13, 13, 13, 2, 13, 13, 13, 13, 2, 13, 13, 13, 13, 0]
此之谓明王之守折冲千里之外者也	此之谓明王之守，折冲千里之外者也。	[13, 13, 13, 13, 13, 13, 2, 13, 13, 13, 13, 13, 13, 13, 0]
癸卯车驾还宫	癸卯，车驾还宫。	[13, 2, 13, 13, 13, 0]
掌凡杀草之政令	掌凡杀草之政令。	[13, 13, 13, 13, 13, 13, 0]
壬寅缅国遣使贡驯象十	壬寅，缅国遣使贡驯象十。	[13, 2, 13, 13, 13, 13, 13, 13, 13, 0]
戊子以原州总管独孤楷为益州总管	戊子，以原州总管独孤楷为益州总管。	[13, 2, 13, 13, 13, 13, 13, 13, 13, 13, 13, 13, 13, 13, 0]
超更从它道厉度	超更从它道厉度。	[13, 13, 13, 13, 13, 13, 0]
乙未诏常参官已授外任毋得奏举选人	乙未，诏常参官已授外任，毋得奏举选人。	[13, 2, 13, 13, 13, 13, 13, 13, 13, 2, 13, 13, 13, 13, 13, 0]
察每制文笔敕便索本上曰我于姚察文章非唯玩味无已故是一宗匠	察每制文笔，敕便索本，上曰：我于姚察文章，非唯玩味无已，故是一宗匠。	[13, 13, 13, 13, 2, 13, 13, 13, 2, 13, 3, 13, 13, 13, 13, 13, 2, 13, 13, 13, 13, 13, 2, 13, 13, 13, 13, 0]
治也者治常者也道也者道常者也殆物妙言治之害也	治也者，治常者也；道也者，道常者也。殆物妙言，治之害也。	[13, 13, 2, 13, 13, 13, 1, 13, 13, 2, 13, 13, 13, 0, 13, 13, 13, 2, 13, 13, 13, 0]
惟王建国辨方正位体国经野	惟王建国，辨方正位，体国经野。	[13, 13, 13, 2, 13, 13, 13, 2, 13, 13, 13, 0]
旻号令东偏先进王得中叩马谏曰南风甚急非北军之利也宜少待之	旻号令东偏先进，王得中叩马谏曰：南风甚急，非北军之利也，宜少待之。	[13, 13, 13, 13, 13, 13, 2, 13, 13, 13, 13, 13, 13, 3, 13, 13, 13, 2, 13, 13, 13, 13, 13, 2, 13, 13, 13, 0]
旋逆一日退一度在日前夕伏西方	旋，逆，一日退一度，在日前，夕伏西方。	[2, 2, 13, 13, 13, 13, 2, 13, 13, 2, 13, 13, 13, 0]
兵未交而孙揆擒燕卒败所以河西岐下之师望风溃散而浚建至败	兵未交而孙揆擒，燕卒败，所以河西、岐下之师望风溃散，而浚、建至败。	[13, 13, 13, 13, 13, 13, 2, 13, 13, 2, 13, 13, 13, 8, 13, 13, 13, 13, 13, 13, 13, 2, 13, 8, 13, 13, 0]
通妻伯父犯法朗陵长赵俨收治致之大辟	通妻伯父犯法，朗陵长赵俨收治，致之大辟。	[13, 13, 13, 13, 13, 2, 13, 13, 13, 13, 13, 13, 2, 13, 13, 13, 0]
元起诛李奉伯并诸渠帅送季连还京师	元起诛李奉伯并诸渠帅，送季连还京师。	[13, 13, 13, 13, 13, 13, 13, 13, 13, 2, 13, 13, 13, 13, 13, 0]
不知黄河非安流之水伏秋盛发则西拥淮流数十里并灌新开河	不知黄河非安流之水，伏秋盛发，则西拥淮流数十里，并灌新开河。	[13, 13, 13, 13, 13, 13, 13, 13, 2, 13, 13, 13, 2, 13, 13, 13, 13, 13, 13, 13, 2, 13, 13, 13, 13, 0]
光表固辞历年终不肯受	光表固辞，历年终不肯受。	[13, 13, 13, 2, 13, 13, 13, 13, 13, 0]
府法曹断略粮贼惟各决杖一百通判熊曰总略几人	府法曹断略粮贼，惟各决杖一百，通判，熊曰：总略几人？	[13, 13, 13, 13, 13, 13, 2, 13, 13, 13, 13, 13, 2, 13, 2, 13, 3, 13, 13, 13, 9]
累惧而迁于鲁县立尧祠于西山谓之尧山故张衡南部赋曰奉先帝而追孝立唐祠于尧山	累惧而迁于鲁县，立尧祠于西山，谓之尧山。故张衡《南部赋》曰：奉先帝而追孝，立唐祠于尧山。	[13, 13, 13, 13, 13, 13, 2, 13, 13, 13, 13, 13, 2, 13, 13, 13, 0, 13, 13, 10, 13, 13, 11, 3, 13, 13, 13, 13, 13, 2, 13, 13, 13, 13, 13, 0]
故帝数与近习谋诛大臣皆发于仓猝决意无疑	故帝数与近习谋诛大臣，皆发于仓猝，决意无疑。	[13, 13, 13, 13, 13, 13, 13, 13, 13, 2, 13, 13, 13, 13, 2, 13, 13, 13, 0]
庚子司空郭虔免	庚子，司空郭虔免。	[13, 2, 13, 13, 13, 13, 0]
岩外一特石高数丈上岐立如两人僧指为寒山拾得云	岩外一特石，高数丈，上岐立如两人，僧指为寒山、拾得云。	[13, 13, 13, 13, 2, 13, 13, 2, 13, 13, 13, 13, 13, 2, 13, 13, 13, 13, 8, 13, 13, 0]
和帝令迷唐将其种人还大小榆谷	和帝令迷唐将其种人还大、小榆谷。	[13, 13, 13, 13, 13, 13, 13, 13, 13, 13, 8, 13, 13, 0]
王濬之东下也吴城戍皆望风款附独建平太守吾彦婴城不下闻吴亡乃降	王濬之东下也，吴城戍皆望风款附，独建平太守吾彦婴城不下，闻吴亡，乃降。	[13, 13, 13, 13, 13, 2, 13, 13, 13, 13, 13, 13, 13, 2, 13, 13, 13, 13, 13, 13, 13, 13, 13, 13, 2, 13, 13, 2, 13, 0]
惠王亲兄子也今之王者兄子之子也	惠王，亲兄子也；今之王者，兄子之子也。	[13, 2, 13, 13, 13, 1, 13, 13, 13, 2, 13, 13, 13, 13, 0]
广麦独产陕西一名青稞即大麦随土而变而皮成青黑色者秦人专以饲马饥荒人乃食之	广麦独产陕西，一名青稞，即大麦，随土而变。而皮成青黑色者，秦人专以饲马，饥荒人乃食之。	[13, 13, 13, 13, 13, 13, 2, 13, 13, 13, 2, 13, 13, 2, 13, 13, 13, 0, 13, 13, 13, 13, 13, 13, 2, 13, 13, 13, 13, 13, 2, 13, 13, 13, 13, 13, 0]
故其法不用而刑罚不加乎僇人	故其法不用，而刑罚不加乎僇人。	[13, 13, 13, 13, 2, 13, 13, 13, 13, 13, 13, 13, 0]
此吾所以知义之不从愚且贱者出而必自贵且知者出也	此吾所以知义之不从愚且贱者出，而必自贵且知者出也。	[13, 13, 13, 13, 13, 13, 13, 13, 13, 13, 13, 13, 13, 2, 13, 13, 13, 13, 13, 13, 13, 13, 0]
安吐根曰一撮许贼马上刺取掷著汾水中耳	安吐根曰：一撮许贼，马上刺取，掷著汾水中耳！	[13, 13, 13, 3, 13, 13, 13, 2, 13, 13, 13, 2, 13, 13, 13, 13, 13, 12]
及攸之起兵赜行至寻阳未得朝廷处分众欲倍道趋建康赜曰寻阳地居中流密迩畿甸若留屯湓口内籓朝廷外援夏首保据形胜控制西南今日会此天所置也	及攸之起兵，赜行至寻阳，未得朝廷处分，众欲倍道趋建康，赜曰：寻阳地居中流，密迩畿甸。若留屯湓口，内籓朝廷，外援夏首，保据形胜，控制西南，今日会此，天所置也。	[13, 13, 13, 13, 2, 13, 13, 13, 13, 2, 13, 13, 13, 13, 13, 2, 13, 13, 13, 13, 13, 13, 2, 13, 3, 13, 13, 13, 13, 13, 2, 13, 13, 13, 0, 13, 13, 13, 13, 2, 13, 13, 13, 2, 13, 13, 13, 2, 13, 13, 13, 2, 13, 13, 13, 2, 13, 13, 13, 2, 13, 13, 13, 0]
简遂持棒见真妹从厕上出来遂击之妹号叫曰是儿	简遂持棒。见真妹从厕上出来，遂击之。妹号叫曰：是儿。	[13, 13, 13, 0, 13, 13, 13, 13, 13, 13, 13, 2, 13, 13, 0, 13, 13, 13, 3, 13, 0]
而嶷事武帝恭悌尽礼未尝违忤顔色故武帝友爱亦深	而嶷事武帝恭悌尽礼，未尝违忤顔色，故武帝友爱亦深。	[13, 13, 13, 13, 13, 13, 13, 13, 2, 13, 13, 13, 13, 13, 2, 13, 13, 13, 13, 13, 13, 0]
